study_id,coder,date_coded,has_data_badge,has_data_badge_other,data_availability_statement,data_availability_statement_other,article_has_links,article_has_links_other,number_of_links,link_number,link_url,link_work,link_work_noother,resolved_url,is_repository,is_repository_other,repository_name,files_exist,files_exist_other,download_success,download_success_other,notes,use_code,review_note
a000112,michelle,2020-04-28,yes,NA,yes,NA,yes,NA,1,1,https://osf.io/wcuhx/,yes,NA,https://osf.io/wcuhx/,yes,NA,OSF,yes,NA,yes,NA,I didn't have any problems with this article,NA,NA
a000112,sophia,2020-04-17,yes,NA,yes,NA,no,NA,NA,NA,NA,NA,NA,NA,NA,NA,NA,NA,NA,NA,NA,Contained no links to data,NA,NA
a000112,steve,2020-08-09,yes,NA,no,NA,yes,NA,1,1,https://osf.io/wcuhx/,yes,NA,https://osf.io/wcuhx/,yes,NA,OSF,yes,NA,yes,NA,"Straightforward, no issues",NA,NA
a000140,evelyn,2020-04-16,yes,NA,yes,NA,yes,NA,1,1,https://osf.io/4fpkn/,yes,NA,https://osf.io/4fpkn/,yes,NA,OSF,yes,NA,yes,NA,I didn't have any problems with this article,NA,NA
a000140,oliver,2020-04-22,no,NA,no,NA,no,NA,NA,NA,NA,NA,NA,NA,NA,NA,NA,NA,NA,NA,NA,NA,NA,NA
a000140,steve,2020-08-09,yes,NA,yes,NA,yes,NA,1,1,https://osf.io/4fpkn,yes,NA,https://osf.io/4fpkn/,yes,NA,OSF,yes,NA,yes,NA,"Straightforward, no issues",NA,NA
a000146,oliver,2020-04-28,yes,NA,yes,NA,yes,NA,1,1,osf.io/j8wdv,yes,NA,https://osf.io/j8wdv,yes,NA,OSF,yes,NA,yes,NA,NA,NA,NA
a000146,steve,2020-08-31,yes,NA,yes,NA,other,"original article has link to original repo, but there is another repo associated with the corrigendum for the article, which is only accessible from the non-registered version of the original OSF project",2,1,https://osf.io/8x6dw/,yes,NA,https://osf.io/8x6dw,yes,NA,OSF Registries,yes,NA,yes,NA,"Straightforward, no issues",NA,NA
a000146,steve,2020-08-31,yes,NA,yes,NA,other,"original article has link to original repo, but there is another repo associated with the corrigendum for the article, which is only accessible from the non-registered version of the original OSF project",2,2,https://osf.io/j8wdv,yes,NA,https://osf.io/j8wdv,yes,NA,OSF Registries,yes,NA,yes,NA,"This is not directly linked from the article, but very indirectly via the non-registered version of the linked OSF project",NA,NA
a000211,oliver,2020-04-28,other,(see notes field),other,(not completed by coder),no,NA,NA,NA,NA,NA,NA,NA,NA,NA,NA,NA,NA,NA,NA,NA,NA,NA
a000211,sophia,2020-04-10,yes,NA,yes,NA,yes,NA,1,1,https://osf.io/8gyns/,yes,NA,https://osf.io/8gyns/,yes,NA,OSF,yes,NA,yes,NA,I didn't have any problems with this article,NA,NA
a000211,steve,2020-08-09,yes,NA,yes,NA,yes,NA,1,1,http://osf.io/8gyns,yes,NA,https://osf.io/8gyns/,yes,NA,OSF,yes,NA,yes,NA,"Straightforward, no issues",NA,NA
a000219,kongmanas,2020-04-08,yes,NA,yes,NA,yes,NA,1,1,http://dx.doi.org/10.1016/j.jesp.2017.07.005,yes,NA,https://www.sciencedirect.com/science/article/abs/pii/S0022103116304292?via%3Dihub,other,The data file is in the ScienceDirect t website,NA,yes,NA,other,Need to register to before access to download,The data file is in the ScienceDirect website and the registration is needed to download the data file,NA,NA
a000219,matthew,2020-04-23,yes,NA,yes,NA,no,NA,0,NA,NA,NA,NA,NA,NA,NA,NA,NA,NA,NA,NA,The page said that the data is available in the online supplement of the article.,NA,NA
a000219,steve,2020-08-09,yes,NA,yes,NA,yes,NA,1,1,http://dx.doi.org/10.1016/j.jesp.2017.07.005,yes,NA,https://www.sciencedirect.com/science/article/abs/pii/S0022103116304292?via%3Dihub,no,NA,NA,yes,NA,yes,NA,"Straightforward, no issues",NA,NA
a000244,adrian,2020-04-14,yes,NA,no,NA,other,"Link listed as ""Open data"". The actual link URL is not written out",1,1,Open data,yes,NA,https://dataverse.harvard.edu/dataset.xhtml?persistentId=doi:10.7910/DVN/Z5RSKK,yes,NA,Dataverse,yes,NA,yes,NA,"There was just a link called ""Open Data"" under its ""Supplement"" section",NA,NA
a000244,sophia,2020-04-04,yes,NA,no,NA,no,NA,0,NA,NA,NA,NA,NA,NA,NA,NA,NA,NA,NA,NA,Couldn't find any references to open data,NA,NA
a000244,steve,2020-08-08,yes,NA,yes,NA,yes,NA,1,1,https://dataverse.harvard.edu/dataset.xhtml?persistentId=doi:10.7910/DVN/Z5RSKK,yes,NA,https://dataverse.harvard.edu/dataset.xhtml?persistentId=doi:10.7910/DVN/Z5RSKK,yes,NA,Harvard Dataverse,yes,NA,yes,NA,"Straightforward, no issues",NA,NA
a000267,evelyn,2020-05-08,yes,NA,yes,NA,other,provides doi,1,1,doi:10.7910/DVN/W2HZSO,other,article and data materials appear in google search,https://dataverse.harvard.edu/dataset.xhtml?persistentId=doi:10.7910/DVN/W2HZSO,yes,NA,Harvard Dataverse Network,yes,NA,yes,NA,Did not have a direct link tot the files. Instead doi was provided to which the first google result is the article.,NA,NA
a000267,sophia,2020-04-10,yes,NA,yes,NA,yes,NA,1,1,doi:10.7910/DVN/W2HZSO,yes,NA,https://dataverse.harvard.edu/dataset.xhtml?persistentId=doi:10.7910/DVN/W2HZSO,yes,NA,Harvard Dataverse Network,yes,NA,yes,NA,I didn't have any problems with this article,NA,NA
a000390,evelyn,2020-04-04,yes,NA,yes,NA,yes,NA,1,1,doi:10.7910/DVN/SURSEO,no,missing http://,NA,NA,NA,NA,NA,NA,NA,NA,"The link is missing the ""http://"" such that when you click or copy directly from the paper, the link does not work.",NA,NA
a000390,oliver,2020-04-25,yes,NA,yes,NA,other,Article gave DOI number. I found link via Googling DOI number.,1,1,doi:10.7910/DVN/SURSEO,yes,NA,https://dataverse.harvard.edu/dataset.xhtml?persistentId=doi:10.7910/DVN/SURSEO,yes,NA,Harvard version of Dataverse,yes,NA,yes,NA,NA,NA,NA
a000391,michelle,2020-05-05,yes,NA,yes,NA,yes,NA,2,1,https://www.iris-database.org/iris/app/home/detail?id=york:934328,yes,NA,https://www.iris-database.org/iris/app/home/detail?id=york:934328,yes,NA,IRIS DATABASE,yes,NA,other,Need to fill in a form to download data,Did not download data as form is required to be filled out,NA,NA
a000391,michelle,2020-05-05,yes,NA,yes,NA,yes,NA,2,2,https://github.com/knights-lab/douc_gut_sites,yes,NA,https://github.com/knights-lab/douc_gut_sites,yes,NA,GITHUB,yes,NA,yes,NA,I didn't have any problems with this link,NA,NA
a000391,sophia,2020-04-10,yes,NA,yes,NA,yes,NA,1,1,https://www.iris-database.org/iris/app/home/detail?id=york:934328,yes,NA,https://www.iris-database.org/iris/app/home/detail?id=york:934328,yes,NA,IRIS Database,yes,NA,yes,NA,I didn't have any problems with this article,NA,NA
a000391,steve,2020-09-02,yes,NA,yes,NA,other,Article contains both links and provides accession numbers to data resources without hyperlinks,4,1,https://www.iris-database.org/iris/app/home/detail?id=york:934328,yes,NA,https://www.iris-database.org/iris/app/home/detail?id=york:934328,yes,NA,IRIS,other,Registration form required before data can be downloaded,yes,NA,"Straightforward, no issues",NA,NA
a000391,steve,2020-09-02,yes,NA,yes,NA,other,Article contains both links and provides accession numbers to data resources without hyperlinks,4,2,https://github.com/knights-lab/douc_gut_sites,yes,NA,https://github.com/knights-lab/douc_gut_sites,yes,NA,Github,yes,NA,yes,NA,"Straightforward, no issues",NA,NA
a000391,steve,2020-09-02,yes,NA,yes,NA,other,Article contains both links and provides accession numbers to data resources without hyperlinks,4,3,European Bioinformations Institute Accession No. PRJEB11414,other,Needed to navigate to European Bioinformatics Institute website and search by accession number,https://www.ebi.ac.uk/ena/browser/view/PRJEB11414,yes,NA,European Nucleotide Archive,yes,NA,partial,Files exceed 100MB - single file plus metadata downloaded,Large genetic dataset many GB,NA,NA
a000391,steve,2020-09-02,yes,NA,yes,NA,other,Article contains both links and provides accession numbers to data resources without hyperlinks,4,4,European Bioinformations Institute Accession No. PRJEB30873,other,Needed to navigate to European Bioinformatics Institute website and search by accession number,https://www.ebi.ac.uk/ena/browser/view/PRJEB30873,yes,NA,European Nucleotide Archive,yes,NA,yes,NA,Was able to download all files listed on page,NA,NA
a000400,kongmanas,2020-04-08,yes,NA,yes,NA,no,NA,NA,NA,NA,NA,NA,NA,NA,NA,NA,NA,NA,NA,NA,"There was no link to the repository, only supplementary information at the end of the article",NA,NA
a000400,sophia,2020-04-26,yes,NA,yes,NA,no,NA,NA,NA,NA,NA,NA,NA,NA,NA,NA,NA,NA,NA,NA,NA,NA,NA
a000400,steve,2020-08-09,yes,NA,yes,NA,other,Article mentions that data is available as supporting materials,1,1,https://doi.org/10.1002/jnr.24441,yes,NA,https://onlinelibrary.wiley.com/doi/full/10.1002/jnr.24441,no,NA,NA,other,"Some files exist, but in the body of the text, it is noted that raw data is available upon request",yes,NA,"There are data files included as supplementary material, but raw data was not included - it is available on request",NA,NA
a000440,evelyn,2020-05-13,yes,NA,yes,NA,yes,NA,1,1,doi:10.1037/0033-2909.130.5.813,yes,NA,https://osf.io/zfpmd/,yes,NA,OSF,yes,NA,yes,NA,I didn't have any problems with this article,NA,NA
a000440,kongmanas,2020-04-18,yes,NA,yes,NA,yes,NA,1,1,10.17605/OSF.IO/ZFPMD,yes,NA,https://osf.io/zfpmd/,yes,NA,OSF,yes,NA,yes,NA,The URL link to data repositary was in the reference section,NA,NA
a000440,michelle,2020-04-03,yes,NA,yes,NA,no,NA,0,NA,NA,NA,NA,NA,NA,NA,NA,NA,NA,NA,NA,Text says open data can be accessed online but no link specified,NA,NA
a000440,steve,2020-08-09,yes,NA,no,NA,yes,NA,1,1,http://dx.doi.org/10.17605/OSF.IO/ZFPMD,yes,NA,https://osf.io/zfpmd/,yes,NA,OSF,yes,NA,yes,NA,"Straightforward, no issues",NA,NA
a000484,aniruddah,2020-05-15,yes,NA,yes,NA,yes,NA,1,1,https://www.oa.uni-hamburg.de/hattke-kalucza,yes,NA,https://www.oa.uni-hamburg.de/hattke-kalucza,yes,NA,University of Hamburg OA,yes,NA,yes,NA,New repository type.,NA,NA
a000484,michelle,2020-04-07,yes,NA,other,"Does not explicitly have a statement saying data is available, but there is a the text 'Open Data' with a hyperlink",yes,NA,1,1,https://www.oa.uni-hamburg.de/hattke-kalucza,yes,NA,https://www.oa.uni-hamburg.de/hattke-kalucza,yes,NA,UNI HAMBURG,yes,NA,yes,NA,"No explicit statement saying data was available, but hyperlinks existed that linked to a site where data could be downloaded",NA,NA
a000484,sophia,2020-04-26,yes,NA,yes,NA,other,"the article has the phrase ""open data"" which itself is a hyperlink",1,1,https://www.oa.uni-hamburg.de/hattke-kalucza,yes,NA,https://www.oa.uni-hamburg.de/hattke-kalucza,yes,NA,University of Hamburg Open Access Portal,yes,NA,yes,NA,I didn't have any problems with this article,NA,NA
a000493,kongmanas,2020-04-18,yes,NA,yes,NA,yes,NA,1,1,https://www.iris‐database.org/iris/app/home/detail?id=york:934328,no,the link destination was not found,NA,NA,NA,NA,NA,NA,NA,NA,The provided link didn't work,NA,NA
a000493,nguyenlam,2020-04-17,yes,NA,yes,NA,yes,NA,1,1,https://www.iris-database.org/iris/app/home/detail?id=york:934328,no,The link does not work.,NA,NA,NA,NA,NA,NA,NA,NA,The link does not work.,NA,NA
a000493,steve,2020-09-02,yes,NA,yes,NA,other,Article has a link (which is almost certainly incorrect) but also a separate accession number for the raw data with no hyperlink,2,1,https://www.iris-database.org/iris/app/home/detail?id=york:934328,other,Embedded link had a problem so clicking directly resulted in an error but url as written in text was OK - minor edit required to replace the hyphen in the url text,https://www.iris-database.org/iris/app/home/detail?id=york:934328,yes,NA,IRIS,other,Registration form required before data can be downloaded,yes,NA,Link works but is likely irrelevant - need to register/agree to download data,NA,NA
a000493,steve,2020-09-02,yes,NA,yes,NA,other,Article has a link (which is almost certainly incorrect) but also a separate accession number for the raw data with no hyperlink,2,2,BioProject Accession No. PRJNA574440,other,Needed to navigate to BioProject website and search by accession number,https://www.ncbi.nlm.nih.gov/bioproject/?term=PRJNA574440,yes,NA,BioProject,yes,NA,partial,repo has 31 data files to download - just downloaded the first file in list,No hyperlink to data - just accession number and name of repo,NA,NA
a000502,evelyn,2020-05-30,yes,NA,yes,NA,yes,NA,1,1,https://osf.io/8q769/,yes,NA,https://osf.io/8q769/,yes,NA,OSF,yes,NA,yes,NA,I didn't have any problems with this article,NA,NA
a000502,michelle,2020-04-07,yes,NA,yes,NA,yes,NA,2,1,http://osf.io/5itqa,yes,NA,https://osf.io/5itqa,yes,NA,OSF,yes,NA,yes,NA,I didn't have any problems with this article,NA,NA
a000502,michelle,2020-04-07,yes,NA,yes,NA,yes,NA,2,2,http://osf.io/8q769,yes,NA,https://osf.io/8q769,yes,NA,OSF,yes,NA,yes,NA,NA,NA,NA
a000502,oliver,2020-04-25,no,NA,no,NA,no,NA,NA,NA,NA,NA,NA,NA,NA,NA,NA,NA,NA,NA,NA,NA,NA,NA
a000502,steve,2020-08-09,yes,NA,no,NA,yes,NA,2,1,http://osf.io/5itqa,yes,NA,https://osf.io/5itqa,yes,NA,OSF Registries,yes,NA,yes,NA,"Straightforward, no issues",NA,NA
a000502,steve,2020-08-09,yes,NA,no,NA,yes,NA,2,2,http://osf.io/8q769,yes,NA,https://osf.io/8q769,yes,NA,OSF Registries,yes,NA,yes,NA,"Straightforward, no issues",NA,NA
a000512,evelyn,2020-04-23,yes,NA,yes,NA,yes,NA,1,1,https://doi.org/10.1016/j.jesp.2019.103820,yes,NA,https://linkinghub.elsevier.com/retrieve/pii/S0022103118308886,yes,NA,Science Direct,yes,NA,yes,NA,I didn't have any problems with this article,NA,NA
a000512,michelle,2020-04-09,yes,NA,yes,NA,yes,NA,1,1,mendeley.com,yes,NA,https://www.mendeley.com/?interaction_required=true,yes,NA,MENDELEY,other,"Link in the article takes you to the general Mendeley website, unlike the other articles where the link takes you to specific data related to that article. Creation of account required",no,NA,"Registration required, and link gets you to the Mendeley home page rather than the site where the data for the article is. ""De-identified data', supplementary data link: at https://
doi.org/10.1016/j.jesp.2019.103820.",NA,NA
a000512,steve,2020-08-26,yes,NA,yes,NA,other,"Article PDF just links to mendeley.com in general without specific details, but the actual directly links are on journal web page for article (and not in the PDF)",1,1,https://data.mendeley.com/datasets/n23pgm86rr/1,yes,NA,https://data.mendeley.com/datasets/n23pgm86rr/1,yes,NA,Mendeley,yes,NA,yes,NA,"Link in PDF is only to mendeley.com in general, not the specific link",NA,NA
a000518,aniruddah,2020-05-15,yes,NA,yes,NA,yes,NA,1,1,https://iris-database.org,yes,NA,https://iris-database.org/iris/app/home/index,yes,NA,IRIS Digital Repository,yes,NA,yes,NA,"Redirects to home page of IRIS, but searching for authors leads to paper, and hence there are files that were downloaded.",NA,NA
a000518,oliver,2020-04-29,yes,NA,yes,NA,no,NA,NA,NA,NA,NA,NA,NA,NA,NA,NA,NA,NA,NA,NA,No OSF link to data. Only has one OSF link - but is the general homepage at osf.io/tvyxz/,NA,NA
a000518,steve,2020-09-01,yes,NA,yes,NA,yes,NA,1,1,https://iris-database.org,other,"link works, but is to the generic homepage. Searching required to find actual data",https://iris-database.org/iris/app/home/detail?id=york:934567,yes,NA,IRIS,other,Registration form required before data can be downloaded,yes,NA,"Link was to home page of repository, had to search and then complete info form to download data",NA,NA
a000525,matthew,2020-04-23,yes,NA,no,NA,no,NA,0,NA,NA,NA,NA,NA,NA,NA,NA,NA,NA,NA,NA,The mention of open data and no link provided,NA,NA
a000525,phuong,2020-04-17,yes,NA,no,NA,no,NA,0,NA,NA,NA,NA,NA,NA,NA,NA,NA,NA,NA,NA,NA,NA,NA
a000525,steve,2020-09-01,yes,NA,no,NA,yes,NA,1,1,https://osf.io/x8jzb/,yes,NA,https://osf.io/x8jzb/,yes,NA,OSF,yes,NA,yes,NA,"The link is buried in the body of the text and is referred to as ""complete materials"" - no explicit mention of open data",NA,NA
a000532,aniruddah,2020-04-21,yes,NA,yes,NA,other,"This article does not have any explicitly mentioned link to the data, however supplementary materials have been mentioned, which have been downloaded individually and zipped into one file, although the materials were not from a recognized repository, rather a journal database.",1,1,https://doi.org/10.1002/jnr.24485,yes,NA,https://onlinelibrary.wiley.com/doi/abs/10.1002/jnr.24485,no,NA,NA,yes,NA,yes,NA,"This article does not have any explicitly mentioned link to the data, however supplementary materials have been mentioned, which have been downloaded individually and zipped into one file, although the materials were not from a recognized repository, rather a journal database.",NA,NA
a000532,oliver,2020-04-29,yes,NA,yes,NA,no,NA,NA,NA,NA,NA,NA,NA,NA,NA,NA,NA,NA,NA,NA,No OSF link to data. Same as above - but they are separate studies with same issue - just a coincidence. Only has one OSF link - but is the general homepage at osf.io/tvyxz/,NA,NA
a000532,steve,2020-08-09,yes,NA,yes,NA,other,Article mentions that data is available as supporting materials,1,1,https://doi.org/10.1002/jnr.24485,yes,NA,https://onlinelibrary.wiley.com/doi/full/10.1002/jnr.24485,no,NA,NA,other,"Files exist, and mentions that data have been provided as supplementary files, but all files are images or Word documents - not the kind of data files expected for a study like this",yes,NA,The open peer review shows that editors recommended data be shared as supplemental files on website - still not clear if that actually happened though,NA,NA
a000573,evelyn,2020-04-22,yes,NA,yes,NA,yes,NA,1,1,http://dx.doi.org/10.1016/j.jesp.2017.06.015,yes,NA,https://www.sciencedirect.com/science/article/abs/pii/S0022103116307910?via%3Dihub,yes,NA,Science Direct,yes,NA,yes,NA,I didn't have any problems with this article,NA,NA
a000573,sophia,2020-04-27,yes,NA,yes,NA,no,NA,NA,NA,NA,NA,NA,NA,NA,NA,NA,NA,NA,NA,NA,Says it's on the JESP website.,NA,NA
a000573,steve,2020-08-09,yes,NA,yes,NA,other,Links are on journal web page for article not in PDF,1,1,https://data.mendeley.com/datasets/3w48v2nbgc/2,yes,NA,https://data.mendeley.com/datasets/3w48v2nbgc/2,yes,NA,Mendeley,yes,NA,yes,NA,"Straightforward, no issues",NA,NA
a000597,evelyn,2020-05-22,no,NA,no,NA,no,NA,NA,NA,NA,NA,NA,NA,NA,NA,NA,NA,NA,NA,NA,Data badge and availability was not found,NA,NA
a000597,matthew,2020-04-15,no,NA,no,NA,no,NA,NA,NA,NA,NA,NA,NA,NA,NA,NA,NA,NA,NA,NA,Page did not contain any relevance to open data,NA,NA
a000597,sophia,2020-04-26,yes,NA,no,NA,no,NA,NA,NA,NA,NA,NA,NA,NA,NA,NA,NA,NA,NA,NA,NA,NA,NA
a000597,steve,2020-08-08,yes,NA,no,NA,other,"Link on article website, not in PDF",1,1,https://aisel.aisnet.org/trr/vol2/iss1/4/,yes,NA,https://aisel.aisnet.org/trr/vol2/iss1/4/,no,NA,NA,yes,NA,yes,NA,Data source was another article in the same journal,NA,NA
a000672,oliver,2020-04-27,no,NA,other,"""Supplemental material"" at bottom - but no mention of ""open"" data/pratices. Link itself does not lead to a data file.",no,NA,NA,NA,NA,NA,NA,NA,NA,NA,NA,NA,NA,NA,NA,NA,NA,NA
a000672,sophia,2020-04-07,yes,NA,yes,NA,yes,NA,1,1,https://osf.io/73puw/,yes,NA,https://osf.io/73puw/,yes,NA,OSF,yes,NA,yes,NA,I didn't have any problems with this article,NA,NA
a000672,steve,2020-08-09,yes,NA,yes,NA,yes,NA,1,1,https://osf.io/73puw/,yes,NA,https://osf.io/73puw/,yes,NA,OSF,yes,NA,yes,NA,"Straightforward, no issues",NA,NA
a000678,matthew,2020-04-26,yes,NA,no,NA,no,NA,NA,NA,NA,NA,NA,NA,NA,NA,NA,NA,NA,NA,NA,"There was a visible hyperlink in the document, however it was unclickable.",NA,NA
a000678,sophia,2020-04-17,yes,NA,no,NA,no,NA,NA,NA,NA,NA,NA,NA,NA,NA,NA,NA,NA,NA,NA,NA,NA,NA
a000678,steve,2020-08-08,yes,NA,other,"Standard JBPA link to ""Open data"" is there on the first page, but no URL attached. There is a link in a footnote later on.",yes,NA,1,1,https://dataverse.harvard.edu/dataverse/JBPA,yes,NA,https://dataverse.harvard.edu/dataverse/JBPA,yes,NA,Harvard Dataverse,yes,NA,yes,NA,"Link led to the journal's dataverse page, had to follow a link from that page to get to article data",NA,NA
a000685,evelyn,2020-04-05,yes,NA,yes,NA,yes,NA,1,1,http://doi.org/10.7910/DVN/MZKJDR,yes,NA,https://dataverse.harvard.edu/dataset.xhtml?persistentId=doi:10.7910/DVN/MZKJDR,yes,NA,Harvard Dataverse,yes,NA,yes,NA,I didn't have any problems with this article,NA,NA
a000685,michelle,2020-04-23,yes,NA,yes,NA,no,NA,NA,NA,NA,NA,NA,NA,NA,NA,NA,NA,NA,NA,NA,Only contains links for the code and materials required to replicate the analyses in the article. Access to data can be made available upon request via contacting the corresponding author,NA,NA
a000692,evelyn,2020-04-16,yes,NA,yes,NA,yes,NA,1,1,https://doi.org/10.1016/j.jesp.2018.03.018,yes,NA,https://www.sciencedirect.com/science/article/abs/pii/S0022103117303244?via%3Dihub,yes,NA,Science Direct,yes,NA,yes,NA,I didn't have any problems with this article,NA,NA
a000692,michelle,2020-04-23,yes,NA,yes,NA,other,Says data is available via 'online supplements' - there is a link to supplementary data which I will use,1,1,https://doi.org/10.1016/j.jesp.2018.03.018,yes,NA,https://www.sciencedirect.com/science/article/abs/pii/S0022103117303244?via%3Dihub,other,Makes reference to Mendeley (which is the repository),MENDELEY,yes,NA,yes,NA,NA,NA,NA
a000720,evelyn,2020-05-13,yes,NA,yes,NA,yes,NA,1,1,https://figshare.com/articles/Raw_data/6025748,yes,NA,https://figshare.com/articles/Raw_data/6025748,yes,NA,Figshare,yes,NA,yes,NA,I didn't have any problems with this article,NA,NA
a000720,nguyenlam,2020-04-09,yes,NA,yes,NA,yes,NA,1,1,10.6084/m9.figshare.7854731,other,"Need to access ''figsgare.com'' first, then search for the given code",https://figshare.com/search?q=10.6084%2Fm9.figshare.7854731&searchMode=1,yes,NA,Figshare,yes,NA,yes,NA,"Note in ""Link_works_noneither""",NA,NA
a000720,oliver,2020-04-27,yes,NA,yes,NA,no,NA,NA,NA,NA,NA,NA,NA,NA,NA,NA,NA,NA,NA,NA,NA,NA,NA
a000720,steve,2020-08-09,yes,NA,yes,NA,yes,NA,1,1,10.6084/m9.figshare.7854731,yes,NA,https://figshare.com/articles/Attachment/7854731,yes,NA,Figshare,yes,NA,yes,NA,"Straightforward, no issues",NA,NA
a000750,evelyn,2020-04-16,yes,NA,yes,NA,yes,NA,1,1,https://osf.io/4fb7d,yes,NA,https://osf.io/4fb7d,yes,NA,OSF,yes,NA,yes,NA,I didn't have any problems with this article,NA,NA
a000750,oliver,2020-04-28,other,(see notes field),other,(not completed by coder),no,NA,NA,NA,NA,NA,NA,NA,NA,NA,NA,NA,NA,NA,NA,NA,NA,NA
a000750,steve,2020-08-09,yes,NA,no,NA,yes,NA,2,1,https://osf.io/4fb7d/,yes,NA,https://osf.io/4fb7d,yes,NA,OSF Registries,yes,NA,yes,NA,"Straightforward, no issues",NA,NA
a000750,steve,2020-08-09,yes,NA,no,NA,yes,NA,2,2,https://osf.io.yiupc,other,"There was a typo in the URL as supplied, easily fixed",https://osf.io/yiupc/,yes,NA,OSF,yes,NA,yes,NA,"Unclear if this data was for the present article, or the article they were responding to",NA,NA
a000799,adrian,2020-04-14,yes,NA,yes,NA,yes,NA,1,1,https://osf.io/6s8tc/,yes,NA,https://osf.io/6s8tc/,yes,NA,OSF,yes,NA,yes,NA,Data badge not prominent,NA,NA
a000799,oliver,2020-04-21,no,NA,no,NA,no,NA,NA,NA,NA,NA,NA,NA,NA,NA,NA,NA,NA,NA,NA,NA,NA,NA
a000799,steve,2020-08-09,yes,NA,yes,NA,yes,NA,1,1,https://osf.io/6s8tc,yes,NA,https://osf.io/6s8tc,yes,NA,OSF Registries,yes,NA,yes,NA,"Straightforward, no issues",NA,NA
a000808,evelyn,2020-05-22,yes,NA,yes,NA,yes,NA,1,1,https://dataverse.harvard.edu/dataset.xhtml?persistentId=doi:10.7910/DVN/A99NUB,yes,NA,https://dataverse.harvard.edu/dataset.xhtml?persistentId=doi:10.7910/DVN/A99NUB,yes,NA,Harvard Dataverse Network,yes,NA,yes,NA,I didn't have any problems with this article,NA,NA
a000808,kongmanas,2020-04-13,yes,NA,yes,NA,other,The article does not contain the URL to an online repository but it allows to click 'Open Data' which automatically connects to repository destination,1,1,N/A,other,"There is no URL given in the artile, but can click 'Open Data' to connect to repositary destination.",https://dataverse.harvard.edu/dataset.xhtml?persistentId=doi:10.7910/DVN/A99NUB,yes,NA,Harvard Dataverse,yes,NA,yes,NA,"There is no URL given in the artile, but can click 'Open Data' to connect to repositary destination.",NA,NA
a000808,michelle,2020-05-04,yes,NA,other,"Does not explicitly have a statement saying data is available, but there is the text 'Open Data' with a hyperlink",yes,NA,1,1,https://dataverse.harvard.edu/dataset.xhtml?persistentId=doi:10.7910/DVN/A99NUB,yes,NA,https://dataverse.harvard.edu/dataset.xhtml?persistentId=doi:10.7910/DVN/A99NUB,yes,NA,HAVARD DATAVERSE,yes,NA,yes,NA,I didn't have any problems with this article,NA,NA
a000831,michelle,2020-04-21,yes,NA,yes,NA,no,NA,NA,NA,NA,NA,NA,NA,NA,NA,NA,NA,NA,NA,NA,"Under open practices, it says: 'Materials and data for the experiment
are available at (will be available upon publication).' But there is a link to supplementary data: at http://dx.doi.org/10.1016/j.jesp.2017.09.002.",NA,NA
a000831,oliver,2020-04-22,yes,NA,yes,NA,yes,NA,1,1,dx.doi.org/10.1016/j.jesp.2017.09.002,other,Redirects,https://www.sciencedirect.com/science/article/abs/pii/S0022103117302135?via%3Dihub,yes,NA,DOI / ScienceDirect,other,"Makes reference to ""supplementary"" data but cannot be found",no,NA,NA,NA,NA
a000831,steve,2020-08-09,yes,NA,yes,NA,no,NA,NA,NA,NA,NA,NA,NA,NA,NA,NA,NA,NA,NA,NA,"Data availability statement in PDF and online says ""will be available upon publication"" - data could be found by searching online though: https://data.mendeley.com/datasets/bfgy9bk7n3/2",NA,NA
a000845,aniruddah,2020-05-15,yes,NA,yes,NA,yes,NA,1,1,https://www.iris-database.org,yes,NA,https://www.iris-database.org/iris/app/home/index,yes,NA,IRIS Digital Repository,yes,NA,yes,NA,"Redirects to home page of IRIS, but searching for authors leads to paper, and hence there are files that were downloaded.",NA,NA
a000845,evelyn,2020-05-08,yes,NA,yes,NA,no,NA,NA,NA,NA,NA,NA,NA,NA,NA,NA,NA,NA,NA,NA,No data links provided,NA,NA
a000845,sophia,2020-04-20,yes,NA,yes,NA,yes,NA,1,1,https://www.iris-database.org,yes,NA,https://www.iris-database.org/iris/app/home/index;jsessionid=922D67DCE96ADC3EEBE163426726A9DC,yes,NA,IRIS Database,other,the link led to the IRIS homepage,no,NA,I didn't have any problems with this article,NA,NA
