batch_id,batch_date,study_id,Author,Publication Year,Title,Publication Title,pdf_filename
batch0910,2020-08-26,a000011,"Nave, Gideon; Jung, Wi Hoon; Linnér, Richard Karlsson; Kable, Joseph W; Koellinger, Philipp D",2019,Are Bigger Brains Smarter? Evidence From a Large-Scale Preregistered Study,Psychological Science,Refer to Zotero library for PDF/link
batch0910,2020-08-26,a000047,"Rentzsch, Katrin; Schröder‐Abé, Michela",2018,Stability and Change in Domain-specific Self-esteem and Global Self-esteem,European Journal of Personality,Refer to Zotero library for PDF/link
batch0910,2020-08-26,a000099,"Lundquist, Anastasia; Gurung, Regan A. R.",2019,Social Distancing Individuals With Depression: The Impact of Symptom Severity,Psi Chi Journal of Psychological Research,Refer to Zotero library for PDF/link
batch0910,2020-08-26,a000128,Murakami Akira,2016,Modeling Systematicity and Individuality in Nonlinear Second Language Development: The Case of English Grammatical Morphemes,Language Learning,Refer to Zotero library for PDF/link
batch0910,2020-08-26,a000186,"Starns, Jeffrey J.; Cataldo, Andrea M.; Rotello, Caren M.; Annis, Jeffrey; Aschenbrenner, Andrew; Bröder, Arndt; Cox, Gregory; Criss, Amy; Curl, Ryan A.; Dobbins, Ian G.; Dunn, John; Enam, Tasnuva; Evans, Nathan J.; Farrell, Simon; Fraundorf, Scott H.; Gronlund, Scott D.; Heathcote, Andrew; Heck, Daniel W.; Hicks, Jason L.; Huff, Mark J.; Kellen, David; Key, Kylie N.; Kilic, Asli; Klauer, Karl Christoph; Kraemer, Kyle R.; Leite, Fábio P.; Lloyd, Marianne E.; Malejka, Simone; Mason, Alice; McAdoo, Ryan M.; McDonough, Ian M.; Michael, Robert B.; Mickes, Laura; Mizrak, Eda; Morgan, David P.; Mueller, Shane T.; Osth, Adam; Reynolds, Angus; Seale-Carlisle, Travis M.; Singmann, Henrik; Sloane, Jennifer F.; Smith, Andrew M.; Tillman, Gabriel; van Ravenzwaaij, Don; Weidemann, Christoph T.; Wells, Gary L.; White, Corey N.; Wilson, Jack",2019,Assessing Theoretical Conclusions With Blinded Inference to Investigate a Potential Inference Crisis,Advances in Methods and Practices in Psychological Science,Refer to Zotero library for PDF/link
batch0910,2020-08-26,a000228,"Davis, Charles P.; Morrow, Hannah M.; Lupyan, Gary",2019,What Does a Horgous Look Like? Nonsense Words Elicit Meaningful Drawings,Cognitive Science,Refer to Zotero library for PDF/link
batch0910,2020-08-26,a000247,"Silberzahn, R.; Uhlmann, E. L.; Martin, D. P.; Anselmi, P.; Aust, F.; Awtrey, E.; Bahník, Š.; Bai, F.; Bannard, C.; Bonnier, E.; Carlsson, R.; Cheung, F.; Christensen, G.; Clay, R.; Craig, M. A.; Dalla Rosa, A.; Dam, L.; Evans, M. H.; Flores Cervantes, I.; Fong, N.; Gamez-Djokic, M.; Glenz, A.; Gordon-McKeon, S.; Heaton, T. J.; Hederos, K.; Heene, M.; Hofelich Mohr, A. J.; Högden, F.; Hui, K.; Johannesson, M.; Kalodimos, J.; Kaszubowski, E.; Kennedy, D. M.; Lei, R.; Lindsay, T. A.; Liverani, S.; Madan, C. R.; Molden, D.; Molleman, E.; Morey, R. D.; Mulder, L. B.; Nijstad, B. R.; Pope, N. G.; Pope, B.; Prenoveau, J. M.; Rink, F.; Robusto, E.; Roderique, H.; Sandberg, A.; Schlüter, E.; Schönbrodt, F. D.; Sherman, M. F.; Sommer, S. A.; Sotak, K.; Spain, S.; Spörlein, C.; Stafford, T.; Stefanutti, L.; Tauber, S.; Ullrich, J.; Vianello, M.; Wagenmakers, E.-J.; Witkowiak, M.; Yoon, S.; Nosek, B. A.",2018,"Many Analysts, One Data Set: Making Transparent How Variations in Analytic Choices Affect Results",Advances in Methods and Practices in Psychological Science,Refer to Zotero library for PDF/link
batch0910,2020-08-26,a000253,"White, Alex L; Palmer, John; Boynton, Geoffrey M",2018,Evidence of Serial Processing in Visual Word Recognition,Psychological Science,Refer to Zotero library for PDF/link
batch0910,2020-08-26,a000273,"Maes, Marlies; Qualter, Pamela; Vanhalst, Janne; Noortgate, Wim Van den; Goossens, Luc",2019,Gender Differences in Loneliness Across the Lifespan: A Meta-Analysis,European Journal of Personality,Refer to Zotero library for PDF/link
batch0910,2020-08-26,a000294,"Vardy, Tom; Atkinson, Quentin D.",2019,Property Damage and Exposure to Other People in Distress Differentially Predict Prosocial Behavior After a Natural Disaster,Psychological Science,Refer to Zotero library for PDF/link
batch0910,2020-08-26,a000295,"Arroyo, Diana C.; Yilmaz, Yucel",2018,An Open for Replication Study: The Role of Feedback Timing in Synchronous Computer-Mediated Communication,Language Learning,Refer to Zotero library for PDF/link
batch0910,2020-08-26,a000299,"Kraus, Michael W.; Brown, Xanni; Swoboda, Hannah",2019,Dog whistle mascots: Native American mascots as normative expressions of prejudice,Journal of Experimental Social Psychology,Refer to Zotero library for PDF/link
batch0910,2020-08-26,a000300,"Lucas, Nadia; Bourgeois, Alexia; Carrera, Emmanuel; Landis, Theodor; Vuilleumier, Patrik",2019,Impaired visual search with paradoxically increased facilitation by emotional features after unilateral pulvinar damage,Cortex,Refer to Zotero library for PDF/link
batch0910,2020-08-26,a000372,"Yu, Dian; Xiao, Xiao; Bemis, Douglas K; Franconeri, Steven L",2019,Similarity Grouping as Feature-Based Selection,Psychological Science,Refer to Zotero library for PDF/link
batch0910,2020-08-26,a000381,"Daalmans, Serena; Odink, Mariette",2019,Stereotyped but Liked? A Content Analysis of the Presence and Stereotypical Portrayal of Minority Groups in Award-Winning Commercials,Communication Research Reports,Refer to Zotero library for PDF/link
batch0910,2020-08-26,a000389,"West, Tessa V.; Koslov, Katrina; Page-Gould, Elizabeth; Major, Brenda; Mendes, Wendy Berry",2017,Contagious Anxiety: Anxious European Americans Can Transmit Their Physiological Reactivity to African Americans,Psychological Science,Refer to Zotero library for PDF/link
batch0910,2020-08-26,a000391,"Clayton, Jonathan B.; Shields‐Cutler, Robin R.; Hoops, Susan L.; Al‐Ghalith, Gabriel A.; Sha, John C. M.; Johnson, Timothy J.; Knights, Dan",2019,Bacterial community structure and function distinguish gut sites in captive red-shanked doucs (Pygathrix nemaeus),American Journal of Primatology,Refer to Zotero library for PDF/link
batch0910,2020-08-26,a000473,"Fisher, Anna V.; Godwin, Karrie E.; Seltman, Howard",2014,"Visual Environment, Attention Allocation, and Learning in Young                     Children: When Too Much of a Good Thing May Be Bad",Psychological Science,Refer to Zotero library for PDF/link
batch0910,2020-08-26,a000500,"Vanman, Eric J.; Baker, Rosemary; Tobin, Stephanie J.",2018,The burden of online friends: the effects of giving up Facebook on stress and well-being,The Journal of Social Psychology,Refer to Zotero library for PDF/link
batch0910,2020-08-26,a000512,"Posten, Ann-Christin; Mussweiler, Thomas",2019,Egocentric foundations of trust,Journal of Experimental Social Psychology,Refer to Zotero library for PDF/link
batch0910,2020-08-26,a000553,"Morgan-Short, Kara; Marsden, Emma; Heil, Jeanne; Issa II, Bernard I.; Leow, Ronald P.; Mikhaylova, Anna; Mikołajczak, Sylwia; Moreno, Nina; Slabakova, Roumyana; Szudarski, Paweł",2018,Multisite Replication in Second Language Acquisition Research: Attention to Form During Listening and Reading Comprehension,Language Learning,Refer to Zotero library for PDF/link
batch0910,2020-08-26,a000561,"Teodorescu, Kinneret; Erev, Ido",2014,"Learned Helplessness and Learned Prevalence: Exploring the Causal Relations Among Perceived Controllability, Reward                     Prevalence, and Exploration",Psychological Science,Refer to Zotero library for PDF/link
batch0910,2020-08-26,a000563,"Kroeper, Kathryn M.; Muenks, Katherine; Murphy, Mary C.",2019,Marriage Equality: On the Books and on the Ground? An Experimental Audit Study of Beliefs and Behavior towards Same-Sex and Interracial Couples in the Wedding Industry,Analyses of Social Issues and Public Policy,Refer to Zotero library for PDF/link
batch0910,2020-08-26,a000581,"Liu, Jinyu; Thomas, Jason Michael; Higgs, Suzanne",2019,"The relationship between social identity, descriptive social norms and eating intentions and behaviors",Journal of Experimental Social Psychology,Refer to Zotero library for PDF/link
batch0910,2020-08-26,a000595,"Liu, Hong-Zhi; Li, Shu; Rao, Li-Lin",2018,"Out of debt, out of burden: The physical burdens of debt",Journal of Experimental Social Psychology,Refer to Zotero library for PDF/link
batch0910,2020-08-26,a000620,"Bainbridge, Timothy F.; Quinlan, Joshua A.; Mar, Raymond A.; Smillie, Luke D.",2019,Openness/Intellect and Susceptibility to Pseudo-Profound Bullshit: A Replication and Extension,European Journal of Personality,Refer to Zotero library for PDF/link
batch0910,2020-08-26,a000636,"Ribera, Olga Sánchez de; Kavish, Nicholas; Katz, Ian M.; Boutwell, Brian B.",2019,"Untangling Intelligence, Psychopathy, Antisocial Personality Disorder, and Conduct Problems: A Meta-analytic Review",European Journal of Personality,Refer to Zotero library for PDF/link
batch0910,2020-08-26,a000638,"Ghaffari, Minou; Fiedler, Susann",2018,The Power of Attention: Using Eye Gaze to Predict Other-Regarding and Moral Choices,Psychological Science,Refer to Zotero library for PDF/link
batch0910,2020-08-26,a000703,"Sourav, Suddha; Kekunnaya, Ramesh; Shareef, Idris; Banerjee, Seema; Bottari, Davide; Röder, Brigitte",2019,A Protracted Sensitive Period Regulates the Development of Cross-Modal Sound–Shape Associations in Humans,Psychological Science,Refer to Zotero library for PDF/link
batch0910,2020-08-26,a000783,"Sutu, Andreea; Serrano, Surizaday; Schultz, Leah H.; Jackson, Joshua J.; Damian, Rodica Ioana",2019,Creating Through Deviancy or Adjustment? The Link between Personality Profile Normativeness and Creativity,European Journal of Personality,Refer to Zotero library for PDF/link
batch0910,2020-08-26,a000793,"Jünger, Julia; Kordsmeyer, Tobias L.; Gerlach, Tanja M.; Penke, Lars",2018,"Fertile women evaluate male bodies as more attractive, regardless of masculinity",Evolution and Human Behavior,Refer to Zotero library for PDF/link
batch0910,2020-08-26,a000914,"Yurovsky, Daniel; Case, Sarah; Frank, Michael C.",2017,Preschoolers Flexibly Adapt to Linguistic Input in a Noisy Channel,Psychological Science,Refer to Zotero library for PDF/link
batch0910,2020-08-26,a000961,"Johnson, David J.; Cheung, Felix; Donnellan, M. Brent",2014,"Does Cleanliness Influence Moral Judgments?: A Direct Replication of Schnall, Benton, and Harvey (2008)",Social Psychology,Refer to Zotero library for PDF/link
batch0910,2020-08-26,a000969,"Yao, Richard; Wood, Katherine; Simons, Daniel J.",2019,As if by Magic: An Abrupt Change in Motion Direction Induces Change Blindness,Psychological Science,Refer to Zotero library for PDF/link
batch0910,2020-08-26,a000971,"Heyman, Tom; Heyman, Geert",2019,Can prediction-based distributional semantic models predict typicality?,Quarterly Journal of Experimental Psychology,Refer to Zotero library for PDF/link
batch0910,2020-08-26,a000973,"Barberá, Pablo; Jost, John T.; Nagler, Jonathan; Tucker, Joshua A.; Bonneau, Richard",2015,Tweeting From Left to Right: Is Online Political Communication More Than an Echo Chamber?,Psychological Science,Refer to Zotero library for PDF/link
batch0910,2020-08-26,a001005,"Martín-Arévalo, E.; Lupiáñez, J.; Narganes-Pineda, C.; Marino, G.; Colás, I.; Chica, Ana B.",2019,The causal role of the left parietal lobe in facilitation and inhibition of return,Cortex,Refer to Zotero library for PDF/link
batch0910,2020-08-26,a001025,"Williams, Matt N.; Albers, Casper",2019,Dealing with Distributional Assumptions in Preregistered Research,Meta-Psychology,Refer to Zotero library for PDF/link
batch0910,2020-08-26,a001041,"Mikolajczak, Moïra; Gross, James J.; Roskam, Isabelle",2019,"Parental Burnout: What Is It, and Why Does It Matter?",Clinical Psychological Science,Refer to Zotero library for PDF/link
batch0910,2020-08-26,a001066,"Rathbone, Clare J.; Ellis, Judi A.; Ahmed, Samrah; Moulin, Chris J. A.; Ernst, Alexandra; Butler, Chris R.",2019,Using memories to support the self in Alzheimer's disease,Cortex,Refer to Zotero library for PDF/link
batch0910,2020-08-26,a001067,"Everett, Jim A. C.; Faber, Nadira S.; Savulescu, Julian; Crockett, Molly J.",2018,The costs of being consequentialist: Social inference from instrumental harm and impartial beneficence,Journal of Experimental Social Psychology,Refer to Zotero library for PDF/link
batch0910,2020-08-26,a001113,"Zygar, Caroline; Hagemeyer, Birk; Pusch, Sebastian; Schönbrodt, Felix D.",2018,From Motive Dispositions to States to Outcomes: An Intensive Experience Sampling Study on Communal Motivational Dynamics in Couples,European Journal of Personality,Refer to Zotero library for PDF/link
batch0910,2020-08-26,a001121,"Nagle, Charles; Trofimovich, Pavel; Bergeron, Annie",2019,TOWARD A DYNAMIC VIEW OF SECOND LANGUAGE COMPREHENSIBILITY,Studies in Second Language Acquisition,Refer to Zotero library for PDF/link
batch0910,2020-08-26,a001215,Dang Thi Ngoc Yen; Coxhead Averil; Webb Stuart,2017,The Academic Spoken Word List,Language Learning,Refer to Zotero library for PDF/link
batch0910,2020-08-26,a001235,"Przybylski, Andrew K.; Weinstein, Netta",2017,A Large-Scale Test of the Goldilocks Hypothesis: Quantifying the Relations Between Digital-Screen Use and the Mental Well-Being of Adolescents,Psychological Science,Refer to Zotero library for PDF/link
batch0910,2020-08-26,a001247,"Nakata, Tatsuya; Suzuki, Yuichi",2019,"Mixing Grammar Exercises Facilitates Long-Term Retention: Effects of Blocking, Interleaving, and Increasing Practice",The Modern Language Journal,Refer to Zotero library for PDF/link
batch0910,2020-08-26,a001249,"Haesevoets, Tessa; Folmer, Chris Reinders; Bostyn, Dries H.; Hiel, Alain Van",2018,Behavioural Consistency Within the Prisoner's Dilemma Game: The Role of Personality and Situation,European Journal of Personality,Refer to Zotero library for PDF/link
batch0910,2020-08-26,a001280,"Masselink, M.; Van Roekel, E.; Hankin, B.l.; Keijsers, L.; Lodder, G.m.a.; Vanhalst, J.; Verhagen, M.; Young, J.f.; Oldehinkel, A.j.",2018,The Longitudinal Association Between Self-esteem and Depressive Symptoms in Adolescents: Separating Between-Person Effects from Within-Person Effects,European Journal of Personality,Refer to Zotero library for PDF/link
batch0910,2020-08-26,a001290,"Zhang, Yufeng; Chen, Zhuo Job; Li, Hong",2017,Toward a model of risky decisions: Synergistic effect of affect intensity and affective processing on risk-seeking as a function of decision domain,Journal of Experimental Social Psychology,Refer to Zotero library for PDF/link
batch0910,2020-08-26,a001291,Leunissen Joost M.; Sedikides Constantine; Wildschut Tim; Back Mitja,2017,Why Narcissists are Unwilling to Apologize: The Role of Empathy and Guilt,European Journal of Personality,Refer to Zotero library for PDF/link
batch0910,2020-08-26,a001369,"Kane, John V.; Barabas, Jason",2019,No Harm in Checking: Using Factual Manipulation Checks to Assess Attentiveness in Experiments,American Journal of Political Science,Refer to Zotero library for PDF/link
batch0910,2020-08-26,a001397,"Buckingham, Gavin",2019,Examining the size–weight illusion with visuo-haptic conflict in immersive virtual reality,Quarterly Journal of Experimental Psychology,Refer to Zotero library for PDF/link
batch0910,2020-08-26,a001425,"Zheng, Anqing; Tucker-Drob, Elliot M.; Briley, Daniel A.",2019,"National Gross Domestic Product, Science Interest, and Science Achievement: A Direct Replication and Extension of the Tucker-Drob, Cheung, and Briley (2014) Study",Psychological Science,Refer to Zotero library for PDF/link
batch0910,2020-08-26,a001430,"Welsh, David T.; Mai, Ke Michael; Ellis, Aleksander P. J.; Christian, Michael S.",2018,Overcoming the effects of sleep deprivation on unethical behavior: An extension of integrated self-control theory,Journal of Experimental Social Psychology,Refer to Zotero library for PDF/link
batch0910,2020-08-26,a001434,"Maki, Alexander; Rothman, Alexander J.",2017,Understanding proenvironmental intentions and behaviors: The importance of considering both the behavior setting and the type of behavior,The Journal of Social Psychology,Refer to Zotero library for PDF/link
batch0910,2020-08-26,a001443,"Farmer, George D.; Baron-Cohen, Simon; Skylark, William J.",2017,People With Autism Spectrum Conditions Make More Consistent Decisions,Psychological Science,Refer to Zotero library for PDF/link
batch0910,2020-08-26,a001444,"Thai, Michael; Stainer, Matthew J.; Barlow, Fiona Kate",2019,The “preference” paradox: Disclosing racial preferences in attraction is considered racist even by people who overtly claim it is not,Journal of Experimental Social Psychology,Refer to Zotero library for PDF/link
batch0910,2020-08-26,a001454,"Krzyzaniak, Sheherezade L.; Colman, Douglas E.; Letzring, Tera D.; McDonald, Jennifer S.; Biesanz, Jeremy C.",2019,The Effect of Information Quantity on Distinctive Accuracy and Normativity of Personality Trait Judgments,European Journal of Personality,Refer to Zotero library for PDF/link
batch0910,2020-08-26,a001472,"Goffin, Celia; Sokolowski, H. Moriah; Slipenkyj, Michael; Ansari, Daniel",2019,Does writing handedness affect neural representation of symbolic number? An fMRI adaptation study,Cortex,Refer to Zotero library for PDF/link
batch0910,2020-08-26,a001476,"Sommet, Nicolas; Morselli, Davide; Spini, Dario",2018,Income Inequality Affects the Psychological Health of Only the People Facing Scarcity,Psychological Science,Refer to Zotero library for PDF/link
batch0910,2020-08-26,a001489,"Sun, Jessie; Vazire, Simine",2019,Do People Know What They’re Like in the Moment?,Psychological Science,Refer to Zotero library for PDF/link
batch0910,2020-08-26,a001493,"Stavrova, Olga; Ehlebracht, Daniel",2019,"Broken Bodies, Broken Spirits: How Poor Health Contributes to a Cynical Worldview",European Journal of Personality,Refer to Zotero library for PDF/link
batch0910,2020-08-26,a001628,"Tortoriello, Gregory K.; Hart, William",2019,Blurring the Dichotomy of Good and Evil: The Idiosyncratic Helping Strategies Associated with Unmitigated-Agentic and Unmitigated-Communal Personalities,European Journal of Personality,Refer to Zotero library for PDF/link
